[
  {
    "schema_version": 1,
    "component": "verdictan-cli",
    "cli_version": "0.3.1",
    "source_revision": "dddddddddddddddddddddddddddddddddddddddd",
    "executable_sha256": "eeeeeeeeeeeeeeeeeeeeeeeeeeeeeeeeeeeeeeeeeeeeeeeeeeeeeeeeeeeeeeee",
    "packaged": true,
    "protocol_min": 1,
    "protocol_max": 1
  }
]
